{
  "request_id": "fixture-result-1",
  "sample_rate": 24000,
  "items": [
    {"pcm_float32": [0.25, -0.5, 0.125], "valid_sample_count": 3, "duration_seconds": 0.000125}
  ],
  "model": {"name": "Supertone/supertonic-3", "revision": "724fb5abbf5502583fb520898d45929e62f02c0b"},
  "provider": {"configured": "cpu", "actual": "cpu", "dtype": "float32"},
  "quality": {"steps": 7, "speed": 1.05, "silence_seconds": 0.3}
}
